{
  "id": "team/a",
  "role": "team",
  "variant": "a",
  "steal": "Bottom-left portrait with bio copy on the right.",
  "requiresPhoto": true,
  "photoSlots": [
    "photo"
  ],
  "slots": {
    "title": {
      "kind": "text",
      "optional": false,
      "from": "title"
    },
    "body": {
      "kind": "text",
      "optional": false,
      "from": "body"
    },
    "photo": {
      "kind": "image",
      "optional": false,
      "from": "photo"
    },
    "accent": {
      "kind": "shape",
      "optional": false
    }
  },
  "fit": {
    "title": {
      "maxFont": 40,
      "minFont": 24,
      "lineClamp": 2,
      "shrinkMin": 0.75
    },
    "body": {
      "maxFont": 22,
      "minFont": 16,
      "lineClamp": 8,
      "shrinkMin": 0.75
    }
  },
  "pptxMapping": {
    "title": {
      "kind": "text"
    },
    "body": {
      "kind": "text"
    },
    "photo": {
      "kind": "picture"
    },
    "accent": {
      "kind": "shape"
    }
  },
  "layout": {
    "elements": [
      {
        "z": 1,
        "id": "photo",
        "type": "image",
        "slot": "photo",
        "x": 80,
        "y": 320,
        "width": 560,
        "height": 480
      },
      {
        "z": 2,
        "id": "title",
        "type": "text",
        "slot": "title",
        "tokenColor": "ink",
        "fontRole": "display",
        "fontSize": 40,
        "align": "left",
        "x": 720,
        "y": 200,
        "width": 780,
        "height": 120
      },
      {
        "z": 2,
        "id": "body",
        "type": "text",
        "slot": "body",
        "tokenColor": "muted",
        "fontRole": "body",
        "fontSize": 22,
        "align": "left",
        "x": 720,
        "y": 360,
        "width": 780,
        "height": 400
      },
      {
        "z": 0,
        "id": "accent",
        "type": "shape",
        "shape": "ellipse",
        "motif": true,
        "tokenFill": "accent",
        "opacity": 0.45,
        "x": 40,
        "y": 40,
        "width": 180,
        "height": 180
      }
    ]
  }
}