{
  "id": "agenda/a",
  "role": "agenda",
  "variant": "a",
  "steal": "Airy agenda list with opposite corner empty of text.",
  "requiresPhoto": false,
  "photoSlots": [],
  "slots": {
    "title": {
      "kind": "text",
      "optional": false,
      "from": "title"
    },
    "body": {
      "kind": "text",
      "optional": false,
      "from": "body"
    },
    "accent": {
      "kind": "shape",
      "optional": false
    }
  },
  "fit": {
    "title": {
      "maxFont": 48,
      "minFont": 28,
      "lineClamp": 2,
      "shrinkMin": 0.75
    },
    "body": {
      "maxFont": 26,
      "minFont": 18,
      "lineClamp": 6,
      "shrinkMin": 0.75
    }
  },
  "pptxMapping": {
    "title": {
      "kind": "text"
    },
    "body": {
      "kind": "text"
    },
    "accent": {
      "kind": "shape"
    }
  },
  "layout": {
    "elements": [
      {
        "z": 2,
        "id": "title",
        "type": "text",
        "slot": "title",
        "tokenColor": "ink",
        "fontRole": "display",
        "fontSize": 44,
        "align": "left",
        "x": 80,
        "y": 120,
        "width": 620,
        "height": 140
      },
      {
        "z": 2,
        "id": "body",
        "type": "text",
        "slot": "body",
        "tokenColor": "ink",
        "fontRole": "body",
        "fontSize": 24,
        "align": "left",
        "x": 780,
        "y": 180,
        "width": 640,
        "height": 560
      },
      {
        "z": 1,
        "id": "accent",
        "type": "shape",
        "shape": "ellipse",
        "motif": true,
        "tokenFill": "accent",
        "opacity": 0.35,
        "x": 1180,
        "y": 620,
        "width": 280,
        "height": 280
      }
    ]
  }
}