{
  "id": "stats/b",
  "role": "stats",
  "variant": "b",
  "steal": "One hero number ~6× caption; photo strip across bottom.",
  "requiresPhoto": true,
  "photoSlots": ["strip1", "strip2", "strip3"],
  "slots": {
    "v1": {
      "kind": "text",
      "optional": false,
      "from": "stats0.value"
    },
    "l1": {
      "kind": "text",
      "optional": true,
      "from": "stats0.label"
    },
    "title": {
      "kind": "text",
      "optional": true,
      "from": "title"
    },
    "strip1": {
      "kind": "image",
      "optional": false,
      "from": "photo"
    },
    "strip2": {
      "kind": "image",
      "optional": false,
      "from": "photo"
    },
    "strip3": {
      "kind": "image",
      "optional": false,
      "from": "photo"
    },
    "accent": {
      "kind": "shape",
      "optional": false
    }
  },
  "fit": {
    "v1": {
      "maxFont": 160,
      "minFont": 72,
      "lineClamp": 1,
      "shrinkMin": 0.75
    },
    "l1": {
      "maxFont": 28,
      "minFont": 18,
      "lineClamp": 2,
      "shrinkMin": 0.75
    },
    "title": {
      "maxFont": 28,
      "minFont": 18,
      "lineClamp": 1,
      "shrinkMin": 0.75
    }
  },
  "pptxMapping": {
    "v1": { "kind": "text" },
    "l1": { "kind": "text" },
    "title": { "kind": "text" },
    "strip1": { "kind": "picture" },
    "strip2": { "kind": "picture" },
    "strip3": { "kind": "picture" },
    "accent": { "kind": "shape" }
  },
  "layout": {
    "elements": [
      {
        "z": 2,
        "id": "v1",
        "type": "text",
        "slot": "v1",
        "tokenColor": "ink",
        "fontRole": "display",
        "fontSize": 140,
        "align": "center",
        "x": 120,
        "y": 160,
        "width": 1360,
        "height": 220
      },
      {
        "z": 2,
        "id": "l1",
        "type": "text",
        "slot": "l1",
        "tokenColor": "muted",
        "fontRole": "body",
        "fontSize": 24,
        "align": "center",
        "x": 300,
        "y": 420,
        "width": 1000,
        "height": 60
      },
      {
        "z": 1,
        "id": "strip1",
        "type": "image",
        "slot": "strip1",
        "x": 0,
        "y": 560,
        "width": 534,
        "height": 340
      },
      {
        "z": 1,
        "id": "strip2",
        "type": "image",
        "slot": "strip2",
        "x": 533,
        "y": 560,
        "width": 534,
        "height": 340
      },
      {
        "z": 1,
        "id": "strip3",
        "type": "image",
        "slot": "strip3",
        "x": 1066,
        "y": 560,
        "width": 534,
        "height": 340
      },
      {
        "z": 3,
        "id": "accent",
        "type": "shape",
        "shape": "rect",
        "motif": true,
        "tokenFill": "accent",
        "x": 720,
        "y": 500,
        "width": 160,
        "height": 8
      }
    ]
  }
}
